{
  "created_at": "2026-08-16T01:03:27.503350+00:00",
  "dimensions": 2,
  "display": {
    "point_size": 2,
    "show_links": false,
    "trail_alpha": 0.21,
    "viewport_scale": 1.25
  },
  "id": "affinity-preset-d5cf9ee1f072",
  "mechanism": "nonlocal-affinity-v1",
  "note": "Derived from affinity-preset-9e33c556dc55; contraction raised from 0.9898 to 0.9932 by dividing the inward gap from 1.0 by approximately 1.5. All other behavior values unchanged.",
  "parameters": {
    "attraction": 0.023,
    "contraction": 0.9932,
    "repulsion": 0.01,
    "softening": 0.012
  },
  "preview": {
    "agent_count": 5000,
    "initialization": "uniform-square-minus-one-to-one",
    "rng": "mulberry32-v1",
    "steps_per_display_frame": 1
  },
  "production_hint": {
    "execution_authorized": false,
    "integration_authority": "houdini-vex",
    "state": "candidate"
  },
  "project_id": "study-003-nonlocal-affinity-dance",
  "rewiring": {
    "ordering": "before-synchronous-position-update",
    "probability_per_simulation_step": 0.04,
    "rewires_per_event": 6
  },
  "schema_version": 1,
  "seed": 122095,
  "state": "candidate",
  "title": "Cohesive Swirl \u2014 wider contraction v1",
  "visibility": "private"
}
