{
  "created_at": "2026-08-15T22:25:11.653446+00:00",
  "dimensions": 2,
  "display": {
    "point_size": 1.5,
    "show_links": false,
    "trail_alpha": 0.16,
    "viewport_scale": 1.25
  },
  "id": "affinity-preset-7c831d9a7d30",
  "mechanism": "nonlocal-affinity-v1",
  "note": "Verified live Canvas baseline. Preserves the faithful force law and 0.099 per-step relationship gate; candidate only.",
  "parameters": {
    "attraction": 0.02,
    "contraction": 0.995,
    "repulsion": 0.01,
    "softening": 0.01
  },
  "preview": {
    "agent_count": 1000,
    "initialization": "uniform-square-minus-one-to-one",
    "rng": "mulberry32-v1",
    "steps_per_display_frame": 1
  },
  "production_hint": {
    "execution_authorized": false,
    "integration_authority": "houdini-vex",
    "state": "candidate"
  },
  "project_id": "study-003-nonlocal-affinity-dance",
  "rewiring": {
    "ordering": "before-synchronous-position-update",
    "probability_per_simulation_step": 0.099,
    "rewires_per_event": 1
  },
  "schema_version": 1,
  "seed": 122095,
  "state": "candidate",
  "title": "Source defaults \u2014 Canvas baseline",
  "visibility": "private"
}
